{
  "id": "9a8b7c6d-5e4f-4a3b-8c2d-1e0f9a8b7c6d",
  "capability": "book",
  "reference": "bk_2026_10_0042",
  "requester": "wba:https://agents.buyer.example#61htr5smhwVtn-uoJlPJcIrlIhwNukpd4WmSkOZU2T0",
  "quote": "0b7e9a52-3c4d-4e6f-8a1b-2c3d4e5f6a7b",
  "lines": [
    {
      "sku": "PANEL-400",
      "description": "Panel 400 W monocrystalline",
      "quantity": 8,
      "unitAmount": 2500000
    },
    {
      "sku": "INSTALL-STD",
      "description": "Standard roof installation",
      "quantity": 1,
      "unitAmount": 4500000
    }
  ],
  "amount": 24500000,
  "currency": "KES",
  "rail": "ap2",
  "releaseSeq": 101,
  "issuedAt": "2026-10-24T11:40:12Z",
  "proof": {
    "alg": "EdDSA",
    "kid": "edge-2026-10",
    "jws": "eyJhbGciOiJFZERTQSIsImtpZCI6ImVkZ2UtMjAyNi0xMCJ9..8eyxZ0ACorzAH7bhGHXbS5o8MA5TAlpeq3frT4ESBL6ZhbH_GEpPIa8FbGifstSiacRyiOkG8o3FBUa-WocrDQ"
  }
}
